city,tag,dup,matched,name,host,url,snippet,notes
tacoma,weak:op-hours-or-nav,,4PM-12AM,Juniper Botanical Bar,juniperbotanicalbar.com,https://www.juniperbotanicalbar.com/,"9 Monday, Wednesday, Thursday 4PM-12AM Friday, Saturday 3pm-1am Sunday 2pm-8pm SEE YOU SOON ⋆ SEE YO",
five-cities,weak:op-hours-or-nav,,Special,Kanpai Sushi,kanpaibythesea.com,http://kanpaibythesea.com/,carte Combo Sushi and Sashimi Special Rolls Basic Rolls Dessert Kanpai! Order Now Reserve About Get,
tucson,weak:op-hours-or-nav,,11-8pm,Karichimaka Restaurant,karichimaka.com,http://www.karichimaka.com/,"Hours Tues-Sat 11-8pm Sun 11-5pm 520-883-0311 5252 S Mission Rd, Tucson, AZ 85746 Hom",
tacoma,weak:op-hours-or-nav,,special,Katie Downs Waterfront Tavern,katiedowns.com,https://katiedowns.com/menu/,"bread and mixed green salad. Specialty Salads Dressings : Balsamic Vinaigrette · Bleu Cheese · 1,00",
phoenix-central,weak:op-hours-or-nav,,Specials,Kimmyz Tatum Point,kimmyztatumpoint.com,http://www.kimmyztatumpoint.com/,Items Home Menu Events &#038; Specials All Events &#038; Specials Live Music Store Shop Cart Glendal,
spokane,weak:op-hours-or-nav,,11am - 10pm,Kindred Public House,kindredpubhouse.com,http://www.kindredpubhouse.com/,-509 862-4897 Monday - Sunday 11am - 10pm Sun>=1 · Sun>=8,
phoenix-central,weak:op-hours-or-nav,,Special,King Salmon Midtown,kingsalmonsushi.com,http://www.kingsalmonsushi.com/,nu/JWQISNFMZLQ4WRZUP4NAWIFR · Special Rolls · /shop/special-rolls/LZIMWWVQT5QNTJEBUCXUG2HD,
tucson,weak:op-hours-or-nav,,11am - 9pm,KINTOKI SUSHI HOUSE & BAR,kintokisushihouse.com,https://www.kintokisushihouse.com/,"eserve Now Sunday - Thursday: 11am - 9pm​ Friday - Saturday : 11am - 10pm 2960 N 1st Ave, Tucson AZ,",
spokane,weak:op-hours-or-nav,,special,Kismet,kismetspokane.com,http://www.kismetspokane.com/,to check these in case of any special hours! Call or Text (509) 309-2944 for reservations! Kismet 30,
san-luis-obispo,weak:op-hours-or-nav,,special,Kitchen & Vine,kitchennvine.com,https://www.kitchennvine.com/menu,"clusive events, secret menus, special offers/discounts, loyalty rewards & more! Join for free Breakf",
tucson,weak:op-hours-or-nav,,daily,Kiwami Ramen,kiwami-ramenbar.com,http://kiwami-ramenbar.com/menu,"Japanese soul food, prepared daily with love and passion %%anchor%% ""> Appetizers Great taste to st",
tacoma,weak:op-hours-or-nav,,special,Kizuki Ramen & Izakaya (Tacoma Mall),kizuki.com,https://www.kizuki.com/kizuki-menu/,濃 ニンニクとんこつ醤油ラーメン 限量特濃蒜香豚骨醬油拉麵 Specialty extra-rich shoyu-flavored pork broth with an abundance of ga,
five-cities,weak:op-hours-or-nav,,Special,Klondike Pizza,klondikepizza.com,https://klondikepizza.com/,for Klondike Pizza? October’s Special of the Month: Maui Wowie Pizza · Sun>=1 · Sun>=8,
phoenix-central,weak:op-hours-or-nav,,SPECIALS,Knock Kneed Lobster,knockkneedlobster.menutoeat.com,http://knockkneedlobster.menutoeat.com/,"0 sections, 117 items SEAFOOD SPECIALS 20 item s Served with choice of two side orders GRILLED BONEL",
phoenix-central,weak:op-hours-or-nav,,SPECIAL,Kobalt,kobaltbarphoenix.com,http://kobaltbarphoenix.com/,CLICK ON IMAGE FOR MORE INFO SPECIAL EVENTS CLICK ON IMAGE FOR MORE INFO CLICK HERE FOR ONGOING SHO,
scottsdale,weak:op-hours-or-nav,,11AM – 9PM,Koi Poke - DC Ranch,koipoke.com,https://koipoke.com/,"! Hours of Operation Everyday 11AM – 9PM Contact Koi Poke 18221 N Pima Rd Suite 100 &105 Scottsdale,",
tucson,weak:op-hours-or-nav,,special,La Botana Tacos,labotanatacos.com,https://www.labotanatacos.com/,"clusive events, secret menus, special offers/discounts, loyalty rewards & more!",
tucson,weak:op-hours-or-nav,,11am- 5pm,La Chaiteria,lachaiteria.com,https://www.lachaiteria.com/,Happy Summer. Hours: Thursday 11am- 5pm Friday 8am-5pm Saturday 8am-5pm Sunday 8am-5pm Monday 11am-5,
five-cities,weak:op-hours-or-nav,,Special,LA COSTA GRILL,lacostagrillca.com,https://lacostagrillca.com/la-costa-grill/menu/168-Station-Way/,"lled tilapia. + Add to Order Especialidades De La Costa 11 Served with rice, beans & tortillas. Chic",
tucson,weak:op-hours-or-nav,,special,Laffs Comedy Caffé,laffstucson.com,http://www.laffstucson.com/,"charts, and his new hour-long special “Front to Back” can be streamed on YouTube. When he’s not on s",
tucson,weak:op-hours-or-nav,,special,La Frida Mexican Grill & Seafood,lafridamexicangrill.com,https://www.lafridamexicangrill.com/,"itas to mouthwatering seafood specialties, our menu is a celebration of bold flavors, fresh ingredie",
scottsdale,weak:op-hours-or-nav,,special,La Locanda Ristorante Italiano,lalocandaaz.com,https://lalocandaaz.com/scottsdale-la-locanda-ristorante-italiano-drink-menu,"8.00/Bottle Sonoma Valley, CA Specialty Cocktails Bellinitini $15.00 Vodka, peach schnapps, peach ne",
oakland,weak:op-hours-or-nav,,2 PM - 10PM,La Loulou,laloulouwinebar.com,https://www.laloulouwinebar.com/,3 PM - 9:30PM Friday - Sat : 2 PM - 10PM Sunday : 12PM - 8PM Brunch every Sunday: 12PM - 2PM - Free,
phoenix-central,weak:op-hours-or-nav,,Specials,L'amore Italian Restaurant,lamoreitalian.com,http://www.lamoreitalian.com/,"n Drive , Phoenix Menu Drinks Specials Events Parties Jobs Gift Cards Facebook page Instagram page Y",
oakland,weak:op-hours-or-nav,,Specials,Lanesplitter Pizza & Pub,lanesplitterpizzapub.com,https://www.lanesplitterpizzapub.com/?utm_source=gbp,erages Salads Catering Coupon Specials Side Sauce Lanesplitter Sourdough Square Pizza Create Your Ow,
tucson,weak:op-hours-or-nav,,specials,La Parrilla Suiza,laparrillasuiza.com,https://laparrillasuiza.com/tucson-la-parrilla-suiza-about,Suiza also offers vegetarian specials. Call: (480) 892-2872 or come visit us at any of our location,
tucson,weak:op-hours-or-nav,,SPECIAL,La Placita Cafe,laplacitatucson.com,http://laplacitatucson.com/,"drinks | catering | reviews | SPECIAL OFFER! Enchiladas (Two Enchiladas, served with Rice & Beans) d",
spokane,weak:op-hours-or-nav,DUP,Specials,Latah Bistro,latahbistro.com,https://latahbistro.com/spokane-south-hill-spokane-latah-bistro-happy-hours-specials,Toggle navigation Menu Drinks Specials Catering Parties Events Reserve Order Wine Club Wine & Taps L,
spokane,weak:op-hours-or-nav,DUP,Specials,Wine & Taps,latahbistro.com,https://latahbistro.com/spokane-south-hill-spokane-latah-bistro-happy-hours-specials,Toggle navigation Menu Drinks Specials Catering Parties Events Reserve Order Wine Club Wine & Taps L,
oakland,weak:op-hours-or-nav,,4 pm-9pm,Leaning Tower,leaningtowertogo.com,http://www.leaningtowertogo.com/,1.51.51 PM.png · Hi Friends! 4 pm-9pm Tues-Thur 4pm-10pm Fri-Sat CLOSED Sun & Mon · Monday 9:00am -,
oakland,weak:op-hours-or-nav,,Special,Lemat Ethiopian Restaurant,lemateats.com,https://www.lemateats.com/menu/,ble oil to golden perfection. Special Lemat Salad Tender fresh Green salad handled with care from ga,
tacoma,weak:op-hours-or-nav,,9am - 3pm,Le Sel Bistro,leselbistro.com,http://www.leselbistro.com/,&#8203;HOURS Brunch Everyday 9am - 3pm Dinner Wednesday - Sunday 5pm - 9pm Click to set custom HTML,
oakland,weak:op-hours-or-nav,,30 am - 9 pm.,Lin Jia Asian Kitchen,linjiakitchen.com,https://www.linjiakitchen.com/,1:30 am - 9 pm. · Christmas Eve 11:30 to 9 pm · Christmas Day 3:00 pm -,
phoenix-central,weak:op-hours-or-nav,,5pM-12am,Little Rituals,littleritualsbar.com,https://littleritualsbar.com/,/ WeD / Thurs / Sun DOORS AT 5pM-12am FRi/SAT Doors At 5pM - 1AM KITCHEN CLOSES ONE HOUR BEFORE BAR,
scottsdale,weak:op-hours-or-nav,,daily,Little Snitch,littlesnitchscottsdale.com,https://www.littlesnitchscottsdale.com/,lk-Up Coffee Window Our fresh daily bakery counter offers a variety of changing baked goods to sweet,
scottsdale,weak:op-hours-or-nav,,special,Local Bistro,localbistroaz.com,http://localbistroaz.com/,0.302.6050 so our reservation specialists can assist you! Please fill out a form through the link be,
tucson,weak:op-hours-or-nav,,special,Locale Neighborhood Italian Restaurant,localetucson.com,https://www.localetucson.com/,ht at home. Stay updated with special announcements and delightful insights about our delectable bak,
daly-city,weak:op-hours-or-nav,,Specials,Outback Steakhouse,locations.outback.com,https://locations.outback.com/california/daly-city/371-gellert-blvd.?utm_source=gmb&utm_medium=local_search&utm_campaign=website_cta&y_source=1_MTU1MDI2MDYtNzE1LWxvY2F0aW9uLndlYnNpdGU%3D,w Menu Order Now Gift Cards . Specials Bar Catering Rewards About Contact Careers Press Internationa,
phoenix-central,weak:op-hours-or-nav,,daily,The Sicilian Butcher,locations.thesicilianbutcher.com,https://locations.thesicilianbutcher.com/az/phoenix/phoenix/,"s, fresh, handmade pasta made daily and a choose-your-own-meatball experience. VIEW MENU FAMILY RUN,",
spokane,weak:op-hours-or-nav,,Specials,Logan Tavern,logantavernspokane.com,http://www.logantavernspokane.com/,E Eat Menu Small Bites Weekly Specials Drink Draft List Gallery Hours & Location Logan Tavern Your n,
phoenix-central,weak:op-hours-or-nav,DUP,Specials,LongHorn Steakhouse,longhornsteakhouse.com,https://www.longhornsteakhouse.com/specials,"""input"",null,{""type"":""hidden"",""id"":""showHappyHour"",""value"":""""}],[""$"",""input"",null,{""type"":""hidden"",""value"":""1"",""id"":""emailSignupS",
tucson,weak:op-hours-or-nav,DUP,Specials,LongHorn Steakhouse,longhornsteakhouse.com,https://www.longhornsteakhouse.com/specials,"""input"",null,{""type"":""hidden"",""id"":""showHappyHour"",""value"":""""}],[""$"",""input"",null,{""type"":""hidden"",""value"":""1"",""id"":""emailSignupS",
tucson,weak:op-hours-or-nav,DUP,Specials,LongHorn Steakhouse,longhornsteakhouse.com,https://www.longhornsteakhouse.com/specials,"""input"",null,{""type"":""hidden"",""id"":""showHappyHour"",""value"":""""}],[""$"",""input"",null,{""type"":""hidden"",""value"":""1"",""id"":""emailSignupS",
scottsdale,weak:op-hours-or-nav,,Specials,Longshots Bar & Grill,longshotsaz.com,https://longshotsaz.com/happy-hours-specials,event catered · https://longshotsaz.com/happy-hours-specials · https://longshotsaz.com/food-menu · https://tmt.spotapps.co/orderin,
phoenix-central,weak:op-hours-or-nav,,specials,Mariscos Los Arbolitos De Cajeme - Peoria,losarbolitosusa.com,http://losarbolitosusa.com/,home about us menu events & specials reserve order now from the sea to your table SEAFOOD & MEATS,
phoenix-central,weak:op-hours-or-nav,,11am-8pm,Los Reyes De La Torta,losreyesaz.com,https://losreyesaz.com/locations/north-phoenix,020 (602) 870-2967 Mon - Sun: 11am-8pm Menu → Facebook → Yelp → Website → Order Delivery → hola@losr,
phoenix-central,weak:op-hours-or-nav,,special,Los Taquitos,lostaquitosaz.com,https://lostaquitosaz.com/lostaquitos-16th-street?utm_source=google,"At Los Taquitos, we make your special occasions extra memorable with authentic Mexican flavors and w",
five-cities,weak:op-hours-or-nav,,9AM - 3PM,Luca's Deli & Wine,lucasdeliandwine.com,https://www.lucasdeliandwine.com/,"26 Winter Hours: MON - THURS: 9AM - 3PM FRI, SAT, SUN : 9AM - 8PM CLOSED TUESDAY 134 W Branch St, Ar",
phoenix-central,weak:op-hours-or-nav,,9am - 3pm,Lydia's Kitchen & Market,lydiasphx.com,http://www.lydiasphx.com/,80) 725-8034 Hours Tues - fri 9am - 3pm sat 8am-3pm Sun 8am-3pm Lydias Kitchen & market,
scottsdale,weak:op-hours-or-nav,,12-8pm,Flo's,madebyflo.com,https://madebyflo.com/,INE Location Hours: Sun-Thurs 12-8pm Fri & Sat 12-8:30pm Days Closed: July 3 & 4 Thanksgiving Day Ch,
san-luis-obispo,weak:op-hours-or-nav,,special,Alex Madonna’s Gold Rush Steak House,madonnainn.com,https://www.madonnainn.com/calendar/2025/3/6/the-garden-w-special-guest-iceage,"k to All Events The Garden w/ special guest Iceage Thursday, March 6, 2025 6:00 PM 11:00 PM Alex Mad",
tucson,weak:op-hours-or-nav,,special,Arizona Pizza Company,maedayazp.org,https://www.maedayazp.org/,gs Subs Sides & dessert Lunch special & Beverages Specials 13190 E. Colossal cave Rd. #160 (520) 762,
daly-city,weak:op-hours-or-nav,,Special,Majikku Ramen,majikkuramen.net,https://majikkuramen.net/menu,uce 106. Teba-Fry 14.25 House Special deep fried chicken wings 107. Salmon head 17.95 Grilled salmon,
tucson,weak:op-hours-or-nav,DUP,daily,Mama's Famous Pizza & Italian Eats,mamasfamous.com,http://www.mamasfamous.com/,"eshly aged dough, sauces made daily, and premium ingredients come together at Mama’s—a Tucson favori",
tucson,weak:op-hours-or-nav,DUP,daily,Mama's Famous Pizza & Italian Eats,mamasfamous.com,https://mamasfamous.com/,"eshly aged dough, sauces made daily, and premium ingredients come together at Mama’s—a Tucson favori",
tacoma,weak:op-hours-or-nav,,8AM - 2PM,Manny's Place,mannysplacetacoma.com,http://www.mannysplacetacoma.com/,d Takeaway. Tuesday – Friday: 8AM - 2PM Breakfast and Lunch Saturday – Sunday: 8AM - 2PM Breakfast o,
spokane,weak:op-hours-or-nav,,Special,Maracas Mexican Grill South Hill,maracassouthhill.com,https://maracassouthhill.com/,and festive moments! Visit Us Special Requests? Do you have dietary concerns? Questions about an upc,
tucson,weak:op-hours-or-nav,,Special,Maria Bonita Mexican Kitchen,mariabonitamexicankitchenaz.com,https://mariabonitamexicankitchenaz.com/maria-bonita-mexican-kitchen/menu/2708-E-Fort-Lowell-Rd/,sing + Add to Order Sopas de Especialidad / Specialty Soups 7 Albóndigas / Meatballs $13.64 Servido,
tucson,weak:op-hours-or-nav,,Special,Mario's Pizza Tucson,mariospizzatucsonmenu.com,https://www.mariospizzatucsonmenu.com/?utm_source=gbp,"en chile. $10.89 Mario&#x27;s Special Pizza Pepperoni, sausage, mushrooms, green peppers, onions & b",
tucson,weak:op-hours-or-nav,DUP,special,Mariscos Chihuahua,mariscoschihuahua.com,https://mariscoschihuahua.com/menu,inated in lime juice with our special seasonings and chiles. **Tostada de Ceviche 4.95 Add a descrip,
tucson,weak:op-hours-or-nav,DUP,special,Mariscos Chihuahua on Grande,mariscoschihuahua.com,https://mariscoschihuahua.com/menu,inated in lime juice with our special seasonings and chiles. **Tostada de Ceviche 4.95 Add a descrip,
scottsdale,weak:op-hours-or-nav,DUP,Special,Hoppin' Jacks,marriott.com,https://www.marriott.com/en-us/dining/restaurant-bar/phxcb-jw-marriott-scottsdale-camelback-inn-resort-and-spa/78817-hoppin-jacks-at-the-jackrabbit-pool.mi,size Business Program X Close Special Offers Back Special Offers Deals Gift Cards Opens a new window,
spokane,weak:op-hours-or-nav,DUP,Special,The Bistro - Eat. Drink. Connect.®,marriott.com,https://www.marriott.com/en-us/hotels/gegch-courtyard-spokane-downtown-at-the-convention-center/dining/?scid=f2ae0541-1279-4f24-b197-a979c79310b0,Marriott Logo Find & Reserve Special Offers Meetings & Events Vacations Our Brands Our Credit Cards,
tucson,weak:op-hours-or-nav,DUP,Special,Passagio,marriott.com,https://www.marriott.com/en-us/hotels/tussp-jw-marriott-tucson-starr-pass-resort-and-spa/dining/?scid=feed67b0-9a2f-4de1-8df6-114544116108,Marriott Logo Find & Reserve Special Offers Meetings & Events Vacations Our Brands Our Credit Cards,
tucson,weak:op-hours-or-nav,DUP,Special,Salud,marriott.com,https://www.marriott.com/en-us/hotels/tussp-jw-marriott-tucson-starr-pass-resort-and-spa/dining/?scid=feed67b0-9a2f-4de1-8df6-114544116108,Marriott Logo Find & Reserve Special Offers Meetings & Events Vacations Our Brands Our Credit Cards,
tucson,weak:op-hours-or-nav,DUP,Special,Signature Grill with Patio Dining,marriott.com,https://www.marriott.com/en-us/hotels/tussp-jw-marriott-tucson-starr-pass-resort-and-spa/dining/?scid=feed67b0-9a2f-4de1-8df6-114544116108,Marriott Logo Find & Reserve Special Offers Meetings & Events Vacations Our Brands Our Credit Cards,
tucson,weak:op-hours-or-nav,,special,Maru Japanese Noodle Shop,marunoodle.com,https://www.marunoodle.com/,"lum, Takana Veggie and chef's special of the day! You can pick small appetizer ""Takoyaki"", ""Karaage""",
tucson,weak:op-hours-or-nav,,Special,Maru Plus Japanese Restaurant,maruplus.com,http://maruplus.com/,ite Sashimi Assortment Chef's Special Sushi Assortment Traditional Favorite Una ju Customers' Favori,
spokane,weak:op-hours-or-nav,,special,The Milk Bottle,marylous.org,http://marylous.org/,no better way to celebrate a special occasion than by serving a super special ice cream treat. We o,
oakland,weak:op-hours-or-nav,,special,Marzano,marzanorestaurant.com,http://www.marzanorestaurant.com/blog-3-1/2025/11/22/oaklands-holiday-gathering-spot-italian-dining-at-marzano,"holidays make that feel extra special. Kids love our comforting dishes, parents appreciate the relax",
scottsdale,weak:op-hours-or-nav,DUP,specials,Maui Fish House,mauifishhouse.com,https://www.mauifishhouse.com/,er Online Menu gallery weekly specials Maui Fish House home Become a VIP Sign In More More Catering,
scottsdale,weak:op-hours-or-nav,DUP,specials,Maui Fish House,mauifishhouse.com,https://www.mauifishhouse.com/,er Online Menu gallery weekly specials Maui Fish House home Become a VIP Sign In More More Catering,
scottsdale,weak:op-hours-or-nav,,Special,Medieval Times Dinner & Tournament,medievaltimes.com,https://www.medievaltimes.com/,"Celebration Package Best for Special Occasions Includes dinner and a show, preferred seating, prior",
five-cities,weak:op-hours-or-nav,,SPECIAL,Mei's | Chinese Restaurant,meischineserestaurants.com,https://www.meischineserestaurants.com/menus,nu items. Call Us CHEF&#x27;S SPECIAL APPETIZERS SOUP CHICKEN HEALTHY SELECTIONS SEAFOOD BEEF PORK V,
phoenix-central,weak:op-hours-or-nav,,daily,Mensho Ramen,mensho.com,https://mensho.com/,make a lasting impact on your daily life. Let us help you prosper in your life and town through our,
oakland,weak:op-hours-or-nav,,special,MENSHO,menshopiedmont.com,https://www.menshopiedmont.com/,"clusive events, secret menus, special offers/discounts, loyalty rewards & more! · $500",
scottsdale,weak:op-hours-or-nav,,Daily,Merci French Cafe,mercifc.com,http://www.mercifc.com/,".etc...NON GMO FLOUR Homemade Daily Bake Brioche Bread... Lunch-Dejeuner Our Quiches , Onion soup ,",
oakland,weak:op-hours-or-nav,,special,Merritt House Cocktail Bar,merritthouseoak.com,http://merritthouseoak.com/,ideal setting for celebrating special occasions or corporate functions. Come Enjoy a Day at the Lake,
phoenix-central,weak:op-hours-or-nav,,Specials,Metro Sportz Bar & Billiards,metrosportzbar.com,http://www.metrosportzbar.com/,"Billiards, Phoenix, AZ Drink Specials Poster @ Metro Sportz Bar & Billiards, Phoenix, AZ Diamond Po",
tucson,weak:op-hours-or-nav,DUP,special,Miss Saigon,misssaigontucson.com,http://www.misssaigontucson.com/,ur newsletter for updates and special deals. First name * Last name * Email * Phone Submit Powered a,
tucson,weak:op-hours-or-nav,DUP,special,Miss Saigon,misssaigontucson.com,https://www.misssaigontucson.com/,ur newsletter for updates and special deals. First name * Last name * Email * Phone Submit Powered a,
scottsdale,weak:op-hours-or-nav,,special,Mochilero Kitchen,mochilerokitchenscottsdale.com,http://www.mochilerokitchenscottsdale.com/,"enjoy a casual night out or a special celebration, Mochilero Kitchen invites you to savor the passio",
scottsdale,weak:op-hours-or-nav,,Special,Modern Corner Grill,moderncornergrill.com,https://moderncornergrill.com/scottsdale-modern-corner-grill-drink-menu,"6yr “Rye”, Iowa $16.00 Weller Special Reserve $20.00 Whistle Pig 6yr “Rye”, Vermont $18.00 Whistle P",
spokane,weak:op-hours-or-nav,,special,Mojarra Mia! Mexican Seafood Restaurant,mojarramiamexicanseafoodrestaurantwa.com,https://mojarramiamexicanseafoodrestaurantwa.com/mojarra-mia-mexican-seafood-restaurant/menu/2024-N-Hamilton-St/,"31.50 Shrimp marinated in our special chile sauce and grilled, served with avocado and lime. + Add t",
five-cities,weak:op-hours-or-nav,,special,Monarch Grove Winery Tasting Room,monarchgrovewinery.com,https://monarchgrovewinery.com/pages/about-us,"t of what makes this place so special, and part of what inspires the name Monarch Grove Winery. Our",
tucson,weak:op-hours-or-nav,,special,The Moonstone,moonstonerooftop.com,https://www.moonstonerooftop.com/private-events/,"xquisite setting for all your special occasions. Whether you're planning a corporate gathering, a mi",
spokane,weak:op-hours-or-nav,,10AM - 12AM,Morty's Tap & Grille,mortystapandgrille.com,http://www.mortystapandgrille.com/,f Operation Monday - Thursday 10AM - 12AM Friday - Sunday 8AM - 12AM Back To Top Morty's Tap and Gri,
oakland,weak:op-hours-or-nav,,5pm-10pm,Mua,muaoakland.com,https://muaoakland.com/,"ner Tuesday-Thursday, Sunday: 5pm-10pm Fridays and Saturday: 5pm-11pm Bar menu Tuesday-Thursday, Sun",
tucson,weak:op-hours-or-nav,,12PM - 2AM,Murphys Public House,murphyspublichouseaz.com,http://www.murphyspublichouseaz.com/,e menu items. OPERATING HOURS 12PM - 2AM EVERYDAY ALL CREDIT CARDS ACCEPTED ​ CONTACT 140 S Kolb Rd,
scottsdale,weak:op-hours-or-nav,DUP,10am-9pm,Rosati's Pizza & Sports Pub,myrosatis.com,https://myrosatis.com/scottsdaledynamite/,480-513-2552 Hours Mon- Fri: 10am-9pm Sat-Sun: 11am-9pm Social Local Coupons Coupon Signup Want to,
tucson,weak:op-hours-or-nav,DUP,30am-8pm,Rosati's Pizza,myrosatis.com,http://myrosatis.com/tucsonina,ing: CLOSED Christmas Eve: 10:30am-8pm Christmas Day: CLOSED Social Coupon Signup Want to get exclus,
tucson,weak:op-hours-or-nav,DUP,30am-9pm,Rosati's Pizza,myrosatis.com,https://myrosatis.com/tucsontanqueverde/,.760.4777 Hours Sun-Thurs: 10:30am-9pm Fri-Sat: 10:30am-10pm Holiday Hours: Thanksgiving: CLOSED Chr,
scottsdale,weak:op-hours-or-nav,,Special,NakedQ BBQ,nakedq.com,http://www.nakedq.com/,"Submit Thanks for submitting! Special Offers, Promotions, Events, and more! Phoenix- Open Monday-Sat",
phoenix-central,weak:op-hours-or-nav,,Specials,Nami Korean Kitchen & Sushi,nami-koreankitchenaz.com,https://nami-koreankitchenaz.com/specials,p to main content Menu Drinks Specials Order Parties Catering Jobs Reserve Facebook page Instagram p,
phoenix-central,weak:op-hours-or-nav,,Specials,Nee House Chinese Restaurant,neehousechinese.com,https://www.neehousechinese.com/x2cw2pkq/nee-house-chinese-cuisine-phoenix-85032/order-online#menu-section,"viewMode"":""carousel"",""title"":""Specials & Coupons"",""entityId"":55266,""discounts"":""$44:props:discounts""",
tucson,weak:op-hours-or-nav,,special,Ni's Asian Bistro & Sushi Bar,nisasianbistro.com,http://www.nisasianbistro.com/,"ed with creative toppings. I especially love their signature rolls, which offer a perfect balance of",
spokane,weak:op-hours-or-nav,DUP,12pm–10pm,No-Li Bier Hall,nolibrewhouse.com,https://www.nolibrewhouse.com/bierhall,2 Hours Thursday - Saturday : 12pm–10pm Sunday-Wednesday: 12pm - 9pm Phone (509) 242-2739 BEER SELTZ,
spokane,weak:op-hours-or-nav,DUP,12pm-8pm,No-Li Brewhouse,nolibrewhouse.com,http://nolibrewhouse.com/,Days a Week Main Pub Sun-Wed: 12pm-8pm Thurs - Sat: 12pm-9pm BIER HALL: Sun-Wed: 12pm-9pm Thurs - Sa,
tacoma,weak:op-hours-or-nav,,3 PM - 10 PM,North 47 Brewing Co.,north47brewery.com,https://www.north47brewery.com/,53.517.9865 ​ Hours Mon-Thur: 3 PM - 10 PM Fri: 2 PM - 11 AM Sat: 1 PM - 11 AM Sun: 1 PM - 8 PM Ente,
oakland,weak:op-hours-or-nav,,special,North Light,northlight.bar,http://northlight.bar/,ut. We can work with you on a special menu and playlist. Happy to discuss details and put a hold on,
tucson,weak:op-hours-or-nav,,12 pm -8 pm,NYPD New York Pizza Department,nypizzadepartment.com,http://nypizzadepartment.com/,Sunday Sunday 11:00 -8:30 pm 12 pm -8 pm Delivery TANQUE VERDE Sun - Thurs 11:15 - 8:00 pm Fri - Sa,
oakland,weak:op-hours-or-nav,,daily,The Landing Café,oaklandzoo.org,https://www.oaklandzoo.org/dining,"00pm Tusker&#x27;s Grill Open daily, Tusker&#x27;s Grill is located in Parrott Plaza, right inside t",
scottsdale,weak:op-hours-or-nav,,special,Ocean 44,ocean44.com,https://www.ocean44.com/,n 44 in Scottsdale Planning a special occasion or corporate gathering? Host your next event in one o,
tucson,weak:op-hours-or-nav,,special,The Oink Cafe,oinkcafe.com,http://oinkcafe.com/,"ade-to-order, scratch-kitchen specialties to our famous bacon flights , we bring together bold flavo",
five-cities,weak:op-hours-or-nav,,11am - 9pm,Old Village Grill,oldvillagegrill.biz,http://oldvillagegrill.biz/,Thurs 11am - 8:30pm Fri - Sat 11am - 9pm Order Delivery Contact us for Fundraising Events Click Here,
phoenix-central,weak:op-hours-or-nav,,Special,Pei Wei Asian Kitchen,order.peiwei.com,https://order.peiwei.com/store/8074,"dAt"":""asap""}] · Search Menu · Special Instructions: $specialInstructions$ · Back to Menu · Add Speci",
tucson,weak:op-hours-or-nav,,11am-2am,On The Rocks (OTR),otrtucson.com,https://otrtucson.com/,#160;protected] Open Everyday 11am-2am Kitchen: Sunday until 9pm Monday-Thursday 10pm Friday - Satur,
tucson,weak:op-hours-or-nav,,5pm-12am,Owls Club,owlsclubwest.com,http://www.owlsclubwest.com/,"tt Ave — Tucson, AZ Tue–Thu | 5pm-12am Fri—Sat | 5pm-1am Sun | 7pm-12am Drink List",
san-luis-obispo,weak:op-hours-or-nav,,Daily,Ox and Anchor,oxandanchor.com,https://oxandanchor.com/menu/dinner/,"OYSTERS ON THE HALF SHELL * ""Daily Market"" Oysters, Champagne, Shallot Mignonette 3.50 ea PRAWN COC",
five-cities,weak:op-hours-or-nav,,5PM-9PM,Oyster Loft,oysterloft.com,https://oysterloft.com/,y & Tuesday Wednesday-Sunday: 5PM-9PM View Menu Who’s joining you at the bar tonight? Featuring mu M,
five-cities,weak:op-hours-or-nav,,special,Palo Mesa Pizza II,palomesapizza.com,https://www.palomesapizza.com/,"clusive events, secret menus, special offers/discounts, loyalty rewards & more! · $500 · Menu:155058",
san-luis-obispo,weak:op-hours-or-nav,,Special,Pancho's Mexican Food,panchossrestaurant.com,http://www.panchossrestaurant.com/,reakfast Burritos Early Birds Special $ 9.50 8 am &#8211; 11 am Monday Nachos Chicken or beef $ 10.9,
scottsdale,weak:op-hours-or-nav,,Specials,Pangaea Dinosaur Grill,pangaeadinosaurgrill.com,https://pangaeadinosaurgrill.com/,ownload PDF June Food & Drink Specials (Two Pages) Please click 'Next' below for June Drink Specials,
