city,tag,dup,matched,name,host,url,snippet,notes
spokane,weak:op-hours-or-nav,,Daily,Park Inn,parkinnspokane.com,http://www.parkinnspokane.com/,ADS APPETIZERS Check Here For Daily Lunch Specials and Other Updates from Facebook THIRSTY? ALWAYS O,
tacoma,weak:op-hours-or-nav,,DAILY,Parky's Pizza Bar,parkyspizzabar.com,https://www.parkyspizzabar.com/,"ley ave tacoma, wa 98404 OPEN DAILY starting at 4pm PARK IT LIKE ITS HOT Happenings WE'LL BE HERE AL",
spokane,weak:op-hours-or-nav,,special,Patron Mexican Restaurant,patronspokane.com,https://www.patronspokane.com/,", green and white sauce. This special dish features one each of our Enchilada Blanca, Enchilada Verd",
scottsdale,weak:op-hours-or-nav,DUP,special,Pei Wei Asian Kitchen,peiwei.com,https://www.peiwei.com/news-and-announcements/chef-jet-tilas-special-appearance-on-good-morning-arizona/,"y, 2024 Chef Jet Tila&#8217;s special appearance on Good Morning Arizona Don&#8217;t miss Celebrity",
scottsdale,weak:op-hours-or-nav,DUP,special,Pei Wei Asian Kitchen,peiwei.com,https://www.peiwei.com/news-and-announcements/chef-jet-tilas-special-appearance-on-good-morning-arizona/,"y, 2024 Chef Jet Tila&#8217;s special appearance on Good Morning Arizona Don&#8217;t miss Celebrity",
tucson,weak:op-hours-or-nav,DUP,special,Pei Wei Asian Kitchen,peiwei.com,https://www.peiwei.com/news-and-announcements/chef-jet-tilas-special-appearance-on-good-morning-arizona/,"y, 2024 Chef Jet Tila&#8217;s special appearance on Good Morning Arizona Don&#8217;t miss Celebrity",
tucson,weak:op-hours-or-nav,,special,Penelope Pizza,penelopepizza.com,http://www.penelopepizza.com/,"SS For Order Now / Menu · For special events and catering inquiries, or questions, reach out to us –",
scottsdale,weak:op-hours-or-nav,DUP,Special,Persian Room Fine Dining,persianroom.com,http://persianroom.com/,ight Lamb Shanks Persian Room Special Platter Rack of Lamb Vegeterian Gheimeh Bademjan Discover our,
tucson,weak:op-hours-or-nav,DUP,Special,Persian Room Fine Dining,persianroom.com,https://www.persianroom.com/,ight Lamb Shanks Persian Room Special Platter Rack of Lamb Vegeterian Gheimeh Bademjan Discover our,
oakland,weak:op-hours-or-nav,,specials,Philomena,philomenapizza.com,https://www.philomenapizza.com/,ority access to giveaways and specials Bonus entries into monthly lottery (free pizza?! Yum!) Plenty,
oakland,weak:op-hours-or-nav,,Special,Phnom Penh,phnompenhhouse.com,http://www.phnompenhhouse.com/,"013. Photo: Preston Gannaway, Special To The Chronicle Check us out on: Check, Please! Bay Area Revi",
phoenix-central,weak:op-hours-or-nav,,daily,Krachai Thai Kitchen,phoenixbestthaifood.com,http://phoenixbestthaifood.com/index.htm,pes Each sauce is handcrafted daily from family recipes passed down from generation to generation. I,
tacoma,weak:op-hours-or-nav,,Special,Pho Saigon House,phosaigonhouse.com,http://www.phosaigonhouse.com/,ervation Subscribe to Get Our Special Offers Subscribe Now Thank you &hearts; for being a part of us,
spokane,weak:op-hours-or-nav,,Special,Pho Thinh,phothinhwa.com,https://phothinhwa.com/pho-thinh-wa/menu/6022-N-Division-St/,"cken, Grilled Pork, BBQ pork, Special. Topped with cucumber, house pickles, and cilantro. + Add to O",
tucson,weak:op-hours-or-nav,,Specials,Piezano's,piezanostucson.com,https://www.piezanostucson.com/?utm_source=gbp,Cheese Calzone $13.00 Bundle Specials Bundle #1 - Baken Penne/Spaghetti with Meatballs with an addi,
spokane,weak:op-hours-or-nav,,special,Pinot's Palette,pinotspalette.com,https://pinotspalette.com/spokane,"gh? Join our rewards club for special perks, including free paint and sip classes! Join Now Have an",
five-cities,weak:op-hours-or-nav,,special,Tastes of the Valleys,pismowineshop.com,http://pismowineshop.com/,der. · Never miss an event or special offer. · Wine Club · /shop/wine-club/CK5CTS22RL3TLD6OPOLTIA3T,
phoenix-central,weak:op-hours-or-nav,,Special,Pitic Restaurant and Lounge,piticrestaurant.com,http://www.piticrestaurant.com/,and Salsa Spanish Shrimp with Special Sauce 15.00 3 Egg Omelette with Shrimp sautéed in a savory spi,
phoenix-central,weak:op-hours-or-nav,,special,Pizza A Metro,pizzametroaz.com,https://www.pizzametroaz.com/,"Book Table × Let us host your special event! Whether a birthday party, office function or any other",
scottsdale,weak:op-hours-or-nav,,10am–9pm,PINO,pizzapino.us,http://pizzapino.us/,"AZ 85054 Hours Monday–Sunday 10am–9pm Phone (480) 513-7466 7000 E Mayo Blvd #1070, Phoenix, AZ 8505",
spokane,weak:op-hours-or-nav,,SPECIALS,Pizza Rita,pizzarita.net,https://pizzarita.net/pizza-specials.ydev,ESSERTS WINGS JOIN OUR TEAM - SPECIALS - Choose any 2 Topping s w/ Garlic Cheesy Bread MEDIUM $1 8 .,
phoenix-central,weak:op-hours-or-nav,DUP,11am - 9pm,Pane Bianco Central,pizzeriabianco.com,https://www.pizzeriabianco.com/pizzeria-bianco-heritage-square,) 258-8300 Monday - Saturday: 11am - 9pm Sunday: CLOSED THE Original PIZZERIA BIANCO Chris Bianco st,
phoenix-central,weak:op-hours-or-nav,DUP,11am - 9pm,Pizzeria Bianco,pizzeriabianco.com,https://www.pizzeriabianco.com/pizzeria-bianco-town-country,(602) 368-3273 Monday-Sunday: 11am - 9pm Thank you for choosing to dine with us! Please make a reser,
phoenix-central,weak:op-hours-or-nav,DUP,11am - 9pm,Pizzeria Bianco,pizzeriabianco.com,https://www.pizzeriabianco.com/pizzeria-bianco-heritage-square,) 258-8300 Monday - Saturday: 11am - 9pm Sunday: CLOSED THE Original PIZZERIA BIANCO Chris Bianco st,
phoenix-central,weak:op-hours-or-nav,,special,Cactus Tavern,places.singleplatform.com,http://places.singleplatform.com/cactus-tavern/menu?ref=google,"fresh flounder, fried in our special beer batter. Served with French fries and homemade tartar sauc",
phoenix-central,weak:op-hours-or-nav,,DAILY,Press Coffee - The Roastery,presscoffee.com,https://presscoffee.com/pages/location-roastery,our 2nd floor. FRESH ROASTED DAILY Our team roasts daily. Stop by and watch our roasting process fi,
san-luis-obispo,weak:op-hours-or-nav,,Daily,Press Quesadilla Grill,pressqg.com,http://pressqg.com/,"der now Scratch-Made, Pressed Daily. arrow_right_alt order now Custom-Built Salads & Bowls. arrow_ri",
scottsdale,weak:op-hours-or-nav,,Special,Pub Rock,pubrocklive.com,https://www.pubrocklive.com/events/super-cereal-hangover-special,"Events Super Cereal Hangover Special: a Side Stage Musical Comedy Event Thursday, January 1, 2026 7",
tucson,weak:op-hours-or-nav,,daily,Pure Poke and Prep,purepokeprep.com,http://purepokeprep.com/,"and Sushi Grade Salmon , cut daily and tossed with scratch made Poke marinades, topped your way a v",
spokane,weak:op-hours-or-nav,,specials,QQ Sushi & Kitchen,qqsushiandkitchen.com,https://www.qqsushiandkitchen.com/,"e or our fresh sushi. We have specials of new and interesting sushi daily. Try our secret recipe, fr",
spokane,weak:op-hours-or-nav,,special,Radio Bar Spokane,radiobarspokane.com,https://radiobarspokane.com/,. #spo Tonight&#039;s dinner special is our tarragon-chicken s Tomorrow (Tuesday 5/26) will be chil,
tucson,weak:op-hours-or-nav,,12 - 8pm,Raijin Ramen,raijinramen.com,http://www.raijinramen.com/,"DRINKS | Tuesday to Saturday: 12 - 8pm | | Sundays: 4pm - 8pm&#8203; | 2955 E Speedway Blvd, Tucson,",
spokane,weak:op-hours-or-nav,,Specials,Rancho Chico,ranchochicomexican.com,https://ranchochicomexican.com/,Postres Kids Menu Lunch Menu Specials Los Burritos Taco Salad Small Combinations Fresh &#038; Healt,
scottsdale,weak:op-hours-or-nav,,specials,Randy's Restaurant & Ice Cream,randysrestaurantaz.com,https://www.randysrestaurantaz.com/about/,pcoming announcements and new specials! Facebook Instagram Electronic Gift Card Email Sign-Up powere,
oakland,weak:op-hours-or-nav,DUP,special,Red Boy Pizza on Leimert,redboypizza.com,https://redboypizza.com/about-us,"nest herbs, spices, and other special ingredients, Red Boy Pizza produces the highest quality pizza",
oakland,weak:op-hours-or-nav,DUP,special,Red Boy Pizza Redwood Road,redboypizza.com,https://redboypizza.com/about-us,"nest herbs, spices, and other special ingredients, Red Boy Pizza produces the highest quality pizza",
spokane,weak:op-hours-or-nav,DUP,Special,Red Dragon Northside,reddragonspokane.com,https://www.reddragonspokane.com/,"Chicken, Fried Prawns $21.95 Special Chow Mein $14.95 Generals Chicken $20.95 Spring Rolls $8.95 BB",
spokane,weak:op-hours-or-nav,DUP,Special,Red Dragon Spokane,reddragonspokane.com,http://www.reddragonspokane.com/,"Chicken, Fried Prawns $21.95 Special Chow Mein $14.95 Generals Chicken $20.95 Spring Rolls $8.95 BB",
tucson,weak:op-hours-or-nav,,Specials,Le Rendez-vous,rendezvoustucson.com,http://www.rendezvoustucson.com/,"s and Location Menu Our Story Specials Press Gallery Gift Cards Reservations 3844 Fort Lowell Road,",
scottsdale,weak:op-hours-or-nav,,special,El Pollo Loco,restaurants.elpolloloco.com,https://restaurants.elpolloloco.com/az/scottsdale/15540-n-hayden-rd?utm_source=gmb&utm_medium=yext,"ire-grill whole chickens in a special recipe of herbs, spices, fruit juices and garlic to create a t",
scottsdale,weak:op-hours-or-nav,,daily,Rift Wine Bar & Taphouse,riftbaraz.com,https://www.riftbaraz.com/,ith curbside pickup available daily. · Trivia Every Monday at 7pm. Food Truck Schedule Below · Order,
spokane,weak:op-hours-or-nav,,11am-3pm,Rincon Tapatio,rincontapatio.net,https://rincontapatio.net/menu,"Menu Served Monday - Friday | 11am-3pm All combos served with rice, refried or whole cholesterol fre",
spokane,weak:op-hours-or-nav,,11am-3pm,Rincón Tapatío,rincontapatiomarket.com,https://rincontapatiomarket.com/menu/,"erved Monday &#8211; Friday | 11am-3pm All combos served with rice, refried or whole cholesterol fre",
tucson,weak:op-hours-or-nav,,special,Roadies,roadhousecinemas.com,https://roadhousecinemas.com/entertainment-center/roadies,"iewing parties. Whether for a special occasion or a fun night out, our vibrant atmosphere, delicious",
oakland,weak:op-hours-or-nav,,Specials,Rob Ben’s Restaurant & Lounge,robbensrestaurant.com,https://robbensrestaurant.com/happy-hours-specials,p to main content Menu Drinks Specials Events Jobs Go to top Google page Google page Toggle navigati,
tucson,weak:op-hours-or-nav,,SPECIAL,"Rudy's ""Country Store"" and Bar-B-Q",rudys.com,http://www.rudys.com/,menu JOIN OUR EMAIL LIST FOR SPECIAL OFFERS! And SEND Home Menu Locations Online Store Feedback Gro,
spokane,weak:op-hours-or-nav,,11am - 9pm,Rusty Moose,rustymooserestaurant.com,http://www.rustymooserestaurant.com/,0 Friday-Saturday 11:00-10:00 11am - 9pm · 11am - 10pm · Sun>=1 · Sun>=8,
tucson,weak:op-hours-or-nav,,11AM - 9PM,Saguaro Corners Restaurant & Bar,saguarocorners.com,http://www.saguarocorners.com/,l. HOURS: Tuesday - Saturday: 11AM - 9PM Sundays: 10AM - 8PM (Closed Mondays) Brunch on SUNDAYS from,
scottsdale,weak:op-hours-or-nav,,special,Saigon District Pho and Boba,saigondistrictphoboba.com,http://www.saigondistrictphoboba.com/,"BBQ Pork Sandwich Served with special sauce, butter, pickled daikon/carrots, cucumbers, cilantro, an",
tucson,weak:op-hours-or-nav,DUP,daily,Salsa Verde Restaurant,salsaverdemx.com,http://www.salsaverdemx.com/,storage.com/services/bookings-daily-agenda-widget/1.640.0/DailyAgendaViewerWidget.bundle.min.js · ./,
tucson,weak:op-hours-or-nav,DUP,daily,Salsa Verde Restaurant,salsaverdemx.com,http://www.salsaverdemx.com/,storage.com/services/bookings-daily-agenda-widget/1.640.0/DailyAgendaViewerWidget.bundle.min.js · ./,
tucson,weak:op-hours-or-nav,,Special,Samurai Sombrero,samuraisombrero.com,https://samuraisombrero.com/,sombrero.com 520-999-5938 Add Special Instructions · Update Your Special Instructions · Special inst,
five-cities,weak:op-hours-or-nav,,11am-5pm,Sans Liege Wines,sansliege.com,http://sansliege.com/,", Paso Robles Open Thurs-Tues 11am-5pm Closed Wednesdays PISMO BEACH 870 Price St, Pismo Beach Open",
scottsdale,weak:op-hours-or-nav,,special,"Born & Bred, Scottsdale",scottsdale.bornandbredarizona.com,https://scottsdale.bornandbredarizona.com/,"to Inquire × Let us host your special event! Whether a birthday party, office function or any other",
spokane,weak:op-hours-or-nav,,11AM - 12AM,Screaming Yak,screamingyak.com,http://www.screamingyak.com/,"464-3641 Hours Monday - Thurs 11AM - 12AM Friday - Sunday 8AM - 12AM 118 W Francis Ave, Spokane, WA",
daly-city,weak:op-hours-or-nav,,daily,Seapot Daly City,seapotusa.com,https://www.seapotusa.com/daly-city-ca,storage.com/services/bookings-daily-agenda-widget/1.640.0/DailyAgendaViewerWidget.bundle.min.js · ME,
tucson,weak:op-hours-or-nav,DUP,DAILY,Seis Kitchen,seiskitchen.com,https://www.seiskitchen.com/,th chips. · Seis Cantina OPEN DAILY · Screenshot 2026-05-19 at 10.36.12 AM.png · Screenshot 2025-02-,
tucson,weak:op-hours-or-nav,DUP,DAILY,Seis Kitchen,seiskitchen.com,https://www.seiskitchen.com/,th chips. · Seis Cantina OPEN DAILY · Screenshot 2026-05-19 at 10.36.12 AM.png · Screenshot 2025-02-,
scottsdale,weak:op-hours-or-nav,,Daily,Señor Taco Express Scottsdale,senortacoexpress.com,https://senortacoexpress.com/menu/,_tab][fusion_tab title=&#8221;Daily Specials&#8221; icon=&#8221;&#8221;] #1 &#8211; 3 ROLLED TACOS w,
tucson,weak:op-hours-or-nav,DUP,11AM - 8PM,Serial Grillers,serialgrillersaz.com,https://www.serialgrillersaz.com/houghtonordering,7 (520) 574-7878 HOURS MONDAY 11AM - 8PM TUESDAY 11AM - 8PM WEDNESDAY 11AM - 8PM THURSDAY 11AM - 8PM,
tucson,weak:op-hours-or-nav,DUP,specials,Serial Grillers (Speedway Blvd.),serialgrillersaz.com,http://www.serialgrillersaz.com/,"online ordering, plus weekly specials like Taco Tuesday featuring our Toro Loco menu. SITE HOME MEN",
spokane,weak:op-hours-or-nav,,special,Shelby's Burgers,shelbysburgers.com,https://shelbysburgers.com/,"ries! Choose us for your next special occasion or get-together. Got a birthday party, rehearsal dinn",
san-luis-obispo,weak:op-hours-or-nav,,special,Shindig Cider,shindigcider.com,https://www.shindigcider.com/events,"Paper Squares is back with a special show at Shindig! $7 cover and food by La Parrilla, see you the",
san-luis-obispo,weak:op-hours-or-nav,,30am-10pm,Shin's Sushi,shinssushibar.com,https://www.shinssushibar.com/,View Menu · Sun-Thurs 11:30am-10pm Fri-Sat 11:30am-10:30pm · featured-menu-items@^1.0.0 · Avail,
tucson,weak:op-hours-or-nav,,Special,Shish Kebab House of Tucson,shishkebabaz.com,https://shishkebabaz.com/shish-kebab/menu/5855-E-Broadway-Blvd/,r rice. + Add to Order Mahshi Special Dish $23.95 Eleven grape leaves (dolmas) stuffed with meat & r,
tacoma,weak:op-hours-or-nav,,specials,Side Piece Kitchen,sidepiecekitchen.com,http://www.sidepiecekitchen.com/home,ial slices all of our limited specials are posted weekly only on Instagram proudly industry worker o,
five-cities,weak:op-hours-or-nav,,Special,Sidewalk Café,sidewalkcafeag.smartonlineorder.com,http://sidewalkcafeag.smartonlineorder.com/,- Privacy - Accessibility Add Special Instructions · Update Your Special Instructions · Special inst,
tucson,weak:op-hours-or-nav,,5-11PM,Sisters restaurant & bar,sisterstucson.com,https://sisterstucson.com/,Club Rd. NOW OPEN! TUE-THU | 5-11PM FRI-SAT | 5PM-12AM SUN | 5-11PM *open on Mondays when La Rosa h,
scottsdale,weak:op-hours-or-nav,,special,Sizzle Korean Barbecue,sizzlekoreanbbq.com,http://www.sizzlekoreanbbq.com/,"up-to-date with Sizzle&#039;s special offers, holiday hours and events and more. Name ErrorHere Emai",
scottsdale,weak:op-hours-or-nav,,Special,SugarJam The Southern Kitchen,sjsouthernkitchen.com,https://www.sjsouthernkitchen.com/menus/,"r risk of foodborne illness, especially if you have certain medical conditions**. *Egg items can be",
daly-city,weak:op-hours-or-nav,,Special,Kings West Coast Pizzeria,slicelife.com,https://slicelife.com/restaurants/ny/brooklyn/11217/luv-n-oven-pizza/menu,ategory Pizza Deep Dish Pizza Specialty Pizza Pizzeta Appetizers & Sides Salads Calzones & Rolls Gri,
san-luis-obispo,weak:op-hours-or-nav,,Special,SLO Cider Co.,slociderco.com,https://www.slociderco.com/about-6-1,us know where we need to go! Special Party? We’re more than happy to share our tasting room with yo,
phoenix-central,weak:op-hours-or-nav,,Special,Someburros,someburros.com,https://www.someburros.com/news/join-the-someburros-special-events-team,"s Familia Join the Someburros Special Events Team Do you love sports, great food, and being in the m",
phoenix-central,weak:op-hours-or-nav,,special,Soup & Sausage Bistro,soupnsausagebistro.com,https://soupnsausagebistro.com/,"ries! Choose us for your next special occasion or get-together. Got a birthday party, rehearsal dinn",
spokane,weak:op-hours-or-nav,,Special,South Hill Grill,southhillgrillspokane.com,http://www.southhillgrillspokane.com/,"te foods in one place! Chef’s Special Many restaurants have their own take on a sushi boat, but we’r",
tucson,weak:op-hours-or-nav,,Specials,Spice Garden Indian Cuisine,spicegardenaz.com,https://spicegardenaz.com/,ne Main Menu Set Menus Chef’s Specials Dine in or Order Online — Fresh Indian Flavors Anytime. We ar,
phoenix-central,weak:op-hours-or-nav,,Special,Steak 44,steak44.com,https://www.steak44.com/?utm_source=google&utm_medium=organic&utm_campaign=gmb,View Our Menus Need Something Special? Contact Us Vanilla bean gelato layered with homemade hot fudg,
tucson,weak:op-hours-or-nav,,Special,Street Taco and Beer Co.,street.restaurant,https://street.restaurant/,.......................... 3 Specialty Items Street Dog ...........................................,
scottsdale,weak:op-hours-or-nav,,Special,Streets of New York,streetsofnewyork.com,https://www.streetsofnewyork.com/,ite in a new window Slam Dunk Special · /slam-dunk-special · View Our Menu · Daily Specials from Str,
five-cities,weak:op-hours-or-nav,DUP,11 AM - 8 PM,SUSHI KOKKU & Ramen,sushikokkuslo.com,http://www.sushikokkuslo.com/,805-782-9321 Hours Mon - Sat: 11 AM - 8 PM Sun: 11 AM - 7 PM View Location on Google Maps Address 58,
san-luis-obispo,weak:op-hours-or-nav,DUP,11 AM - 8 PM,Sushi Kokku & Ramen,sushikokkuslo.com,http://www.sushikokkuslo.com/,805-782-9321 Hours Mon - Sat: 11 AM - 8 PM Sun: 11 AM - 7 PM View Location on Google Maps Address 58,
scottsdale,weak:op-hours-or-nav,,Specials,Sushi Ko,sushikoscottsdale.com,https://sushikoscottsdale.com/scottsdale-sushiko-happy-hours-specials,e navigation Menu Food Drinks Specials Order Reserve Parties Catering Jobs Events About us Facebook,
tacoma,weak:op-hours-or-nav,,Special,Sushi Tama Restaurant,sushitamarestaurant.com,http://sushitamarestaurant.com/,e a great experience with us. Special Events and Catering Our restaurant is available for private ev,
tucson,weak:op-hours-or-nav,,SPECIALS,Sushi Zona,sushizona.com,https://www.sushizona.com/menu/,[Return To Navigation] LUNCH SPECIALS Chef&#8217;s choice arrangements of fresh sushi and sashimi.,
tacoma,weak:op-hours-or-nav,,Special,Tacoma Axe Throwing,tacaxe.com,https://www.tacaxe.com/,5% OFF 🎖️ Military Discounts Special rates for JBLM & first responders 🎉 Group Events Unit activit,
tucson,weak:op-hours-or-nav,,SPECIALS,Taco Fish,tacofishtucson.com,https://tacofishtucson.com/#mobile-menu-toggle,"as $2.99 Coke, Sprite, Frasca SPECIALS CONTACT US 4841 S 12th Ave, Tucson, AZ, United States, Arizon",
tucson,weak:op-hours-or-nav,DUP,SPECIAL,Taco Giro,tacogiro.com,https://tacogiro.com/,"OF DRINKS COME AND ENJOY OUR SPECIAL MIX DRINKS, MARGARITAS AND MICHELADAS! DRINKS MENU Discover th",
tucson,weak:op-hours-or-nav,DUP,SPECIAL,TACO GIRO - Craycroft,tacogiro.com,https://tacogiro.com/,"OF DRINKS COME AND ENJOY OUR SPECIAL MIX DRINKS, MARGARITAS AND MICHELADAS! DRINKS MENU Discover th",
tucson,weak:op-hours-or-nav,,6-8pm,TACO GIRO | Valencia,tacogiro.shop,https://tacogiro.shop/,"t perform on Sundays, between 6-8pm, are a phenomenal experience. The food is absolutely exquisite a",
tacoma,weak:op-hours-or-nav,,Specials,Tacoma Pie,tacomapie.com,http://tacomapie.com/,nt Home Our Story Menu Events Specials Delivery / Online Orders Open Menu Close Menu Home Our Story,
tacoma,weak:op-hours-or-nav,,3pm–10pm,The Boom Boom Room Tacoma,tacomasboomboomroom.com,https://tacomasboomboomroom.com/,com (253) 468- 3623 Hours Sun 3pm–10pm Mon-Thurs 3pm–11pm Fri–Sat 3pm–2am Make a Reservation Boom Bo,
tucson,weak:op-hours-or-nav,,10am-8pm,Tacos Apson,tacosapson.com,http://tacosapson.com/,#121 520-395-0871 ​ Mon- Tue 10am-8pm Wed-Sat 10am-9pm Sun-11am-5pm ​ South Location 3501 s. 12th A,
phoenix-central,weak:op-hours-or-nav,,10AM-9PM,Tacos Chiwas,tacoschiwas.com,http://tacoschiwas.com/,"enix AZ 85014 Monday-Saturday 10AM-9PM Sunday 10AM-4PM (602) 358-8830 Chiwas Mesa 127 W Main St, Mes",
spokane,weak:op-hours-or-nav,,Special,Tacos El Sol,tacoselsolwa.com,https://tacoselsolwa.com/tacos-el-sol/menu/3422-N-Division-St/,"hoice of meat. + Add to Order Special Tacos $3.50 Onions, cilantro, lime and selected meat. + Add to",
scottsdale,weak:op-hours-or-nav,,9am-9pm,Gordos Tacos,tacosgordos.com,https://www.tacosgordos.com/,Z (480) 398-8132 Hours Monday 9am-9pm Tuesday 9am-9pm Wednesday 9am-9pm Thursday 9am-9pm Friday 9am-,
tucson,weak:op-hours-or-nav,,special,Tacotote!,tacotote.com,http://www.tacotote.com/,"he tacos and the salsa to any special event big or small, there is tacos for everyone! Start your or",
tacoma,weak:op-hours-or-nav,,Special,Taquería la Michoacana,taquerialamichoacanawa.smartonlineorder.com,https://taquerialamichoacanawa.smartonlineorder.com/,- Privacy - Accessibility Add Special Instructions · Update Your Special Instructions · Special inst,
tucson,weak:op-hours-or-nav,,Specials,Tavolino Ristorante Italiano,tavolinoristorante.com,http://www.tavolinoristorante.com/,"ne, and service. ​ Our Summer Specials are available now through September 30, featuring exceptional",
tucson,weak:op-hours-or-nav,DUP,special,Teaspoon,teaspoontucson.com,http://teaspoontucson.com/,or to closing time. Including special hours. Get directions NEW Location River Center Online Orderin,
tucson,weak:op-hours-or-nav,DUP,special,Teaspoon Foothills,teaspoontucson.com,https://teaspoontucson.com/,or to closing time. Including special hours. Get directions NEW Location River Center Online Orderin,
tucson,weak:op-hours-or-nav,DUP,special,Teresa's Mosaic Cafe,teresasmosaic.com,https://teresasmosaic.com/,"Book Table × Let us host your special event! Whether a birthday party, office function or any other",
tucson,weak:op-hours-or-nav,DUP,special,Theresa's Mosaic,teresasmosaic.com,https://teresasmosaic.com/,"Book Table × Let us host your special event! Whether a birthday party, office function or any other",
tacoma,weak:op-hours-or-nav,,11am-2am,Terry's Office Tavern,terrystacoma.com,https://www.terrystacoma.com/,"t in beer garden! We're Back! 11am-2am, 7 days a week! ​ T 253-752-6262 BAR FAMILY www.parkwaytavern",
spokane,weak:op-hours-or-nav,,daily,The Barrel Steak & Seafood House,thebarrelspokane.com,https://www.thebarrelspokane.com/menu,"or SOUP OF THE DAY Made fresh daily. Cup/Bowl. $ 5 / $ 9 $ 26 THE LOUIE Crab, jumbo prawns, bay shri",
five-cities,weak:op-hours-or-nav,,special,The Break,thebreakpb.com,http://thebreakpb.com/,"r your team and check out our special events. Ice cold, locally brewed beer & wine Feel like a cold",
phoenix-central,weak:op-hours-or-nav,,special,The Duce,theducephx.com,http://www.theducephx.com/,"ows, dance/themed nights, and special productions &mdash; our events team is ready to build the perf",
tucson,weak:op-hours-or-nav,,10am - 2am,The Dugout Sports Bar & Grill,thedugoutbar-and-grill.com,https://thedugoutbar-and-grill.com/,E 22nd Street Tucson AZ Open 10am - 2am Every Day Welcome to The Dugout! Great fun for the whole fa,
spokane,weak:op-hours-or-nav,,11am-9pm,The Flying Goat,theflyinggoat.com,http://www.theflyinggoat.com/,) 327-8277 Sunday — Thursday: 11am-9pm Friday — Saturday: 11am-10pm Republic Pi 611 Manito Shopping,
scottsdale,weak:op-hours-or-nav,,special,Kitchen18,thekitchen18.com,https://www.thekitchen18.com/menus/,"r risk of foodborne illness, especially if you have certain medical conditions. Appetizers Vegetaria",
oakland,weak:op-hours-or-nav,,Special,Parkway Lounge,thenewparkway.com,https://www.thenewparkway.com/about-2/special-events/,"bout Rentals Shop Reaching Us Special Events In addition to our diverse range of weekly offerings, t",
phoenix-central,weak:op-hours-or-nav,,special,The Rebel Lounge,therebellounge.com,http://www.therebellounge.com/,TROY DOHERTY - SOLD OUT! with special guests Tue Jun 16 Troy Doherty Doors at 7:00PM / Show at 8:00P,
tucson,weak:op-hours-or-nav,,Specials,The Rustik Barbershop,therustikcollective.com,https://therustikcollective.com/,stik Collective Store Current Specials Contact Us Privacy Policy Close Log In The Rustiks Mobile &nd,
tucson,weak:op-hours-or-nav,,Specials,The Rustiks Speakeasy Salon and Wine Bar,therustiks.com,http://therustiks.com/,stik Collective Store Current Specials Contact Us Privacy Policy Close Log In The Rustiks Mobile &nd,
oakland,weak:op-hours-or-nav,,specials,The Starry Plough Pub,thestarryplough.com,https://thestarryplough.com/food-drink/,d sharp cheddar for $1. Check specials board for rotating burger. Homemade Chicken Strips Fried chic,
tacoma,weak:op-hours-or-nav,,9am-10pm,The Valley,thevalleytacoma.com,http://www.thevalleytacoma.com/,"acoma, WA 98421 Hours Sunday: 9am-10pm Monday: 11am-10pm Tuesday: 11am-10pm Wednesday: 11am-10pm Thu",
tacoma,weak:op-hours-or-nav,,daily,Thyme Well Spent Cafe,thymewellspentinc.com,https://www.thymewellspentinc.com/,"tes, our soups are made fresh daily. 🥪 Sandwiches – Stacked with flavor. Try our signature turkey a",
tucson,weak:op-hours-or-nav,,special,Tio Ben's Mexican Grill,tiobensmexicangrill.com,https://tiobensmexicangrill.com/tucson-tio-ben-s-mexican-grill-drink-menu,.00/16 oz $8.00/20 oz Modelo Especial $6.00/16 oz $8.00/20 oz Modelo Negra $6.00/16 oz $8.00/20 oz P,
tucson,weak:op-hours-or-nav,,5 pm - 9 pm,Tito and Pep,titoandpep.com,https://www.titoandpep.com/,hours: dinner MONDAY - SUNDAY 5 pm - 9 pm BRUNCH SATURDAY - SUNDAY 11 am - 2 pm RESERVATIONS RECOMME,
